{
  "schema_version": "city-airport-quarterly-operations-config-v1",
  "config_version": "beijing-quarterly-operations-money-v3.1",
  "parameter_schema": "templates/city_airport_quarterly_operations_parameter_schema_v1.json",
  "reference_defaults": "reference_defaults/china_mainland_quarterly_operations_reference_defaults_v1.json",
  "city_airport_market_id": "beijing_airport_system",
  "city_name": "北京",
  "currency": "CNY",
  "amount_unit": "million_cny",
  "design_note": "Beijing city airport quarterly operations parameters. This config provides actual Beijing values; the schema and reference default files are documentation only and are not inherited at runtime.",
  "game_timeline": {
    "simulation_start_year": 2025,
    "startup_operating_history_years": 5,
    "player_decision_start_year": 2030,
    "design_note": "2025-2029 is an automatic operating-history period. The formal player decision phase starts in 2030 with five years of observed airport operations."
  },
  "quarter_component_weights": {
    "business": [0.235, 0.255, 0.245, 0.265],
    "leisure": [0.27, 0.22, 0.3, 0.21],
    "vfr": [0.3, 0.21, 0.27, 0.22],
    "long_haul": [0.245, 0.24, 0.275, 0.24],
    "transfer": [0.245, 0.25, 0.265, 0.24]
  },
  "facility_fixed_operating_cost_million_cny_per_year": {
    "empty": 0.0,
    "small": 220.0,
    "medium": 445.0,
    "large": 1020.0,
    "extra_large": 1780.0,
    "giant": 2550.0
  },
  "slot_fixed_operating_cost_model": {
    "model_version": "slot-fixed-operating-cost-v0.1",
    "design_note": "Fixed operating cost is not depreciation. It starts from facility size, then applies building age, macro cost pressure, city complexity, and quarterly heating/cooling seasonality.",
    "city_complexity_multiplier": 1.02,
    "slot_open_years": {
      "PEK_SLOT_1": 2008,
      "PEK_SLOT_2": 2000,
      "PKX_SLOT_1": 2019,
      "PKX_SLOT_2": 2069
    },
    "age_curve_points": [
      {"age_year": 0, "multiplier": 0.92},
      {"age_year": 5, "multiplier": 0.98},
      {"age_year": 15, "multiplier": 1.08},
      {"age_year": 30, "multiplier": 1.26},
      {"age_year": 45, "multiplier": 1.36},
      {"age_year": 60, "multiplier": 1.42}
    ],
    "quarter_cost_multipliers": {
      "Q1": 1.035,
      "Q2": 0.945,
      "Q3": 1.055,
      "Q4": 0.965
    },
    "macro_cost_pressure": {
      "baseline_index": 50.0,
      "sensitivity": 0.16,
      "min_multiplier": 0.9,
      "max_multiplier": 1.15,
      "weights": {
        "input_core_inflation_cost_index": 0.3,
        "input_energy_cost_pressure_index": 0.35,
        "input_currency_pressure_index": 0.15,
        "input_regional_macro_stress_index": 0.15,
        "input_headline_inflation_cost_index": 0.05
      }
    }
  },
  "facility_renovation_model": {
    "model_version": "facility-renovation-v0.1",
    "design_note": "A renovation is a slot-level investment event in the quarterly operations layer. It temporarily reduces that slot's capacity during construction, becomes a separate renovation asset after completion, and reduces the slot's effective maintenance age without resetting original construction history.",
    "facility_size_catalog": "standard_terminal_sizes_v1",
    "default_construction_capacity_multiplier": 0.75,
    "maintenance_age_retention_ratio": 0.55,
    "minimum_effective_maintenance_age_years": 5.0,
    "city_construction_cost_multiplier": 1.0,
    "replacement_cost_million_cny_by_facility_size": {
      "empty": 0.0,
      "small": 6750.0,
      "medium": 13500.0,
      "large": 28500.0,
      "extra_large": 51000.0,
      "giant": 78750.0
    },
    "capex_ratio_by_facility_size": {
      "small": 0.16,
      "medium": 0.16,
      "large": 0.16,
      "extra_large": 0.16,
      "giant": 0.16
    },
    "duration_quarters_by_facility_size": {
      "small": 4,
      "medium": 5,
      "large": 6,
      "extra_large": 8,
      "giant": 10
    },
    "renovation_asset_depreciation": {
      "useful_life_years": 20,
      "residual_value_pct": 5.0
    }
  },
  "facility_construction_model": {
    "model_version": "facility-construction-v0.1",
    "design_note": "New terminal construction is for empty slots. It does not add capacity during construction; after completion, the city airport market config should expose the slot through its open_year. Capex is recorded during construction and becomes a separate new-build asset after completion.",
    "facility_size_catalog": "standard_terminal_sizes_v1",
    "city_construction_cost_multiplier": 1.0,
    "construction_cost_million_cny_by_facility_size": {
      "empty": 0.0,
      "small": 6750.0,
      "medium": 13500.0,
      "large": 28500.0,
      "extra_large": 51000.0,
      "giant": 78750.0
    },
    "duration_quarters_by_facility_size": {
      "small": 8,
      "medium": 10,
      "large": 14,
      "extra_large": 18,
      "giant": 24
    },
    "new_asset_depreciation": {
      "useful_life_years": 40,
      "residual_value_pct": 10.0
    }
  },
  "facility_rebuild_model": {
    "model_version": "facility-rebuild-v0.2",
    "design_note": "Beijing v0.2 composes a rebuild from demolition of the source size plus new construction of the target size. The slot's effective capacity is fixed at zero throughout. New construction capex is capitalized as a rebuild asset; demolition cost is an operating-period expense, not an asset. Existing initial assets and completed renovation assets on the same slot are written off when work starts.",
    "facility_size_catalog": "standard_terminal_sizes_v1",
    "default_construction_capacity_multiplier": 0.0,
    "city_construction_cost_multiplier": 1.0,
    "city_demolition_cost_multiplier": 1.0,
    "asset_cost_million_cny_by_facility_size": {
      "empty": 0.0,
      "small": 6750.0,
      "medium": 13500.0,
      "large": 28500.0,
      "extra_large": 51000.0,
      "giant": 78750.0
    },
    "demolition_cost_ratio_by_source_facility_size": {
      "small": 0.08,
      "medium": 0.08,
      "large": 0.1,
      "extra_large": 0.12,
      "giant": 0.14
    },
    "demolition_duration_quarters_by_source_facility_size": {
      "small": 4,
      "medium": 5,
      "large": 7,
      "extra_large": 9,
      "giant": 12
    },
    "duration_quarters_by_facility_size": {
      "small": 10,
      "medium": 13,
      "large": 18,
      "extra_large": 24,
      "giant": 32
    },
    "new_asset_depreciation": {
      "useful_life_years": 40,
      "residual_value_pct": 10.0
    }
  },
  "facility_renovation_events": [
    {
      "event_id": "PEK_SLOT_2_RENOVATION_2032Q1",
      "airport_id": "PEK",
      "slot_id": "PEK_SLOT_2",
      "slot_name": "首都T2航站楼",
      "facility_size": "large",
      "start_year": 2032,
      "start_quarter": "Q1",
      "design_note": "Beijing sample renovation event. It is not a capacity upgrade: the slot remains large after completion, but construction temporarily reduces capacity and completion refreshes the effective maintenance age."
    }
  ],
  "facility_construction_events": [
    {
      "event_id": "PKX_SLOT_2_CONSTRUCTION_2065Q3",
      "airport_id": "PKX",
      "slot_id": "PKX_SLOT_2",
      "slot_name": "大兴T2航站楼新建工程",
      "target_facility_size": "large",
      "start_year": 2065,
      "start_quarter": "Q3",
      "design_note": "Beijing sample late new-build event. Standard large duration is 14 quarters, so a 2065Q3 start reaches service in 2069Q1. The city airport market config exposes PKX_SLOT_2 from 2069 so annual passenger allocation can use the completed slot."
    }
  ],
  "facility_rebuild_events": [
    {
      "event_id": "PEK_SLOT_2_REBUILD_2056Q1",
      "airport_id": "PEK",
      "slot_id": "PEK_SLOT_2",
      "slot_name": "首都T2航站楼拆除重建工程",
      "from_facility_size": "large",
      "target_facility_size": "extra_large",
      "start_year": 2056,
      "start_quarter": "Q1",
      "design_note": "Beijing sample rebuild event. The old PEK_SLOT_2 large slot is closed during construction, then returns as an extra_large slot after the standard 24-quarter rebuild duration. Demolition cost is expensed, construction capex becomes a rebuild asset, and previous PEK_SLOT_2 renovation assets are written off at project start."
    }
  ],
  "aeronautical_revenue": {
    "model_version": "aeronautical-revenue-v0.2",
    "base_revenue_per_passenger_cny": 78.0,
    "component_mix_revenue_weights": {
      "business": 1.1,
      "leisure": 0.96,
      "vfr": 0.9,
      "long_haul": 1.28,
      "transfer": 0.82
    },
    "quarter_revenue_multipliers": {
      "Q1": 1.012,
      "Q2": 0.995,
      "Q3": 1.018,
      "Q4": 0.975
    },
    "market_yield_environment": {
      "sensitivity": 0.08,
      "min_multiplier": 0.96,
      "max_multiplier": 1.07,
      "fields": {
        "input_airfare_pressure_index": {
          "baseline": 55.0,
          "scale": 30.0,
          "direction": 1.0,
          "weight": 0.42
        },
        "input_consumer_confidence_index": {
          "baseline": 42.0,
          "scale": 25.0,
          "direction": 1.0,
          "weight": 0.2
        },
        "input_core_inflation_cost_index": {
          "baseline": 50.0,
          "scale": 30.0,
          "direction": 1.0,
          "weight": 0.16
        },
        "input_regional_macro_stress_index": {
          "baseline": 35.0,
          "scale": 30.0,
          "direction": -1.0,
          "weight": 0.22
        }
      }
    },
    "capacity_pricing": {
      "weak_pricing_below_design_utilization_pct": 70.0,
      "full_weak_pricing_design_utilization_pct": 45.0,
      "max_weak_pricing_discount_pct": 2.5,
      "tight_pricing_start_design_utilization_pct": 88.0,
      "full_tight_pricing_design_utilization_pct": 112.0,
      "max_tight_pricing_premium_pct": 3.2
    },
    "crowding_revenue_penalty": {
      "service_quality_penalty_start_design_utilization_pct": 108.0,
      "full_service_quality_penalty_design_utilization_pct": 138.0,
      "max_service_quality_revenue_penalty_pct": 5.0,